key,0,1
#,,
offset,0,4
int32,str,str
0,"TEXT_REGOTH4MYCBWAGI_00694_BWAGI_000_000","幸好成功撤退了……不過真是嚇了我一跳啊。<hex:02100103>大姐頭命令我將情報送到這裡，<hex:02100103>沒想到在博茲雅也能看到那種「異形怪物」……"
1,"TEXT_REGOTH4MYCBWAGI_00694_BWAGI_000_001","雖然不知道是怎麼回事，但看來事情變得複雜了啊。<hex:02100103>我會作為聯絡員暫時留在博茲雅。<hex:02100103>又要請你多關照了。"
2,"TEXT_REGOTH4MYCBWAGI_00694_BWAGI_000_002","話說回來，你有什麼事想問我嗎？"
3,"TEXT_REGOTH4MYCBWAGI_00694_BWAGI_000_005","對手是鬪神嗎……那我們也顯得有些無能為力了啊。<hex:02100103>看來又得靠你了，你的話肯定沒問題！<hex:02100103>畢竟你可是消滅了聖天使阿爾蒂瑪的英雄！"
4,"TEXT_REGOTH4MYCBWAGI_00694_BWAGI_000_006","話說回來，你有什麼事想問我嗎？"
5,"TEXT_REGOTH4MYCBWAGI_00694_BWAGI_000_010","我看見賢人小姐一臉慌張地跑出去了，<hex:02100103>到底是怎麼回事呢？<hex:02100103>雖說積極行動是挺不錯的，但去戰場的話可就太危險了。"
6,"TEXT_REGOTH4MYCBWAGI_00694_BWAGI_000_015","哦！看來你們都沒什麼事啊！<hex:02100103>害我白擔心了！<hex:02100103>你肯定會把剛才發生的事一五一十地告訴我，對吧？"
7,"TEXT_REGOTH4MYCBWAGI_00694_BWAGI_000_016","話說回來，你有什麼事想問我嗎？"
8,"TEXT_REGOTH4MYCBWAGI_00694_BWAGI_000_020","事情變麻煩了啊！<hex:02100103>不過只要有你在肯定會沒問題的，對吧？<hex:02100103>畢竟你可是消滅了聖天使阿爾蒂瑪的英雄！"
9,"TEXT_REGOTH4MYCBWAGI_00694_BWAGI_000_025","是時候展現光榮的達爾馬斯卡火槍手的決意了！<hex:02100103>你的後方就由我來守護！<hex:02100103>放心交給我吧！"
10,"TEXT_REGOTH4MYCBWAGI_00694_BWAGI_000_030","一波未平一波又起嗎……<hex:02100103>我在達爾馬斯卡曾多次見過那艘飛空戰艦，<hex:02100103>這次居然把它調遣到了博茲雅，真是糟糕……"
11,"TEXT_REGOTH4MYCBWAGI_00694_BWAGI_000_031","話說回來，你有什麼事想問我嗎？"
12,"TEXT_REGOTH4MYCBWAGI_00694_BWAGI_000_035","いよいよ大詰めダナ……これからが肝心ダゼ。<hex:02100103>すでに東方連合にも連絡をしてあるから心配ないゼ。<hex:02100103>心強い助っ人たちもいずれ到著するだろうサ！"
13,"TEXT_REGOTH4MYCBWAGI_00694_BWAGI_000_040","東方連合から助っ人が來てくれてるようダゼ。<hex:02100103>背中を任せられる仲間がイルってことはイイもンサ……。<hex:02100103>……アンタの背中はこのオレが護る……任せておきナ！"
14,"TEXT_REGOTH4MYCBWAGI_00694_BWAGI_000_045","ン？　……ダルマスカのことなら気にすンナ！<hex:02100103>まずはこのボズヤから帝國軍を追い出して祖國奪還を実現スル！<hex:02100103>目的達成こそがダルマスカやナグサのためナノサ！"
15,"TEXT_REGOTH4MYCBWAGI_00694_BWAGI_000_050","ダル・リアータにあんな兵器があったなんて知らなカッタゼ。<hex:02100103>だが、アンタがいれば大丈夫サ……なんとかなるって思えるゼ！<hex:02100103>……ン？　アァ、そうか……そういうことか……。"
16,"TEXT_REGOTH4MYCBWAGI_00694_BWAGI_000_051","オレたちがアンタの背中を護っていたんじゃない……<hex:02100103>アンタがオレたちの背中を護ってくれていたンダナ……！<hex:02100103>アンタという存在が、オレたちに希望を與えてくれるンダ……！"
17,"TEXT_REGOTH4MYCBWAGI_00694_BWAGI_000_052","ところで、オレに何か聞きたい事はあるカナ？"
18,"TEXT_REGOTH4MYCBWAGI_00694_Q30_000_000","想了解什麼？"
19,"TEXT_REGOTH4MYCBWAGI_00694_A30_000_000","關於達爾馬斯卡發來的情報"
20,"TEXT_REGOTH4MYCBWAGI_00694_A30_000_001","關於布瓦基"
21,"TEXT_REGOTH4MYCBWAGI_00694_A30_000_002","關於邦加族"
22,"TEXT_REGOTH4MYCBWAGI_00694_A30_000_0010","取消"
23,"TEXT_REGOTH4MYCBWAGI_00694_Q40_000_000","想了解什麼？"
24,"TEXT_REGOTH4MYCBWAGI_00694_A40_000_000","飛空艇イウサール號について"
25,"TEXT_REGOTH4MYCBWAGI_00694_A40_000_0010","キャンセル"
26,"TEXT_REGOTH4MYCBWAGI_00694_BWAGI_100_000","我這次被派遣至此就是為了這件事，<hex:02100103>雖然大姐頭命令我直接告訴頭領白沙恩閣下，<hex:02100103>但既然是你的話，我就共享一下情報吧。"
27,"TEXT_REGOTH4MYCBWAGI_00694_BWAGI_100_001","在博茲雅開始反擊作戰的同時，<hex:02100103>我們達爾馬斯卡和納夏的抵抗組織也在飛燕大人的號令之下<hex:02100103>開始了大規模的反擊作戰。"
28,"TEXT_REGOTH4MYCBWAGI_00694_BWAGI_100_002","我們達爾馬斯卡義軍展開了收復那爾比納城塞的作戰，<hex:02100103>那裡曾被譽為保護王國的鐵壁要塞，<hex:02100103>如今則被叫做帝國兵盟堡……"
29,"TEXT_REGOTH4MYCBWAGI_00694_BWAGI_100_003","雖然兩軍交戰造成了大量傷亡，但我們成功收復了城塞！<hex:02100103>駐守的第四軍團全都夾著尾巴逃跑了。<hex:02100103>納夏好像也成功收復了設有兵站的港口。"
30,"TEXT_REGOTH4MYCBWAGI_00694_BWAGI_100_004","達爾馬斯卡和納夏這次都取得了振奮人心的勝利，<hex:02100103>但是大姐頭說……<hex:02100103>第四軍團的抵抗太微弱了，感覺很奇怪。"
31,"TEXT_REGOTH4MYCBWAGI_00694_BWAGI_100_005","於是我們不敢大意，<hex:02100103>一直在警惕著第四軍團，<hex:02100103>可他們在瓦爾奈的主力部隊完全沒有動靜……"
32,"TEXT_REGOTH4MYCBWAGI_00694_BWAGI_100_006","由於瓦厲斯皇帝被暗殺，帝國內部正處於極度混亂的狀態。<hex:02100103>圍繞繼承權展開的戰鬥已經十分接近於內戰了。<hex:02100103>不……應該說就是內戰！"
33,"TEXT_REGOTH4MYCBWAGI_00694_BWAGI_100_007","根據情報顯示，帝都已經向第四軍團發出了返回命令。<hex:02100103>但伽布拉斯那混蛋完全無視了命令，<hex:02100103>還宣布要在達爾馬斯卡築建新的王國樂土。"
34,"TEXT_REGOTH4MYCBWAGI_00694_BWAGI_100_008","看來他是準備拋棄本國了啊。<hex:02100103>不過這就意味著，他們再也無法得到來自本國的援助了。<hex:02100103>那些傢伙今後就只能憑藉自己的力量戰鬥了。"
35,"TEXT_REGOTH4MYCBWAGI_00694_BWAGI_100_009","很多人都認為這是千載難逢的好機會，<hex:02100103>應該一口氣攻下第四軍團，我也十分認同這個想法……<hex:02100103>但是大姐頭說在掌握確切情報之前先靜觀其變。"
36,"TEXT_REGOTH4MYCBWAGI_00694_BWAGI_100_010","她還認為，應該把第四軍團的動向等所有情報<hex:02100103>都事無巨細地分享給博茲雅義軍，再看博茲雅要如何行動。<hex:02100103>於是就把我給派來了。"
37,"TEXT_REGOTH4MYCBWAGI_00694_BWAGI_100_011","不過這次在南方博茲雅竟然出現了鬪神，<hex:02100103>我感覺大姐頭的擔心應該是對的……<hex:02100103>果然不能小瞧伽布拉斯那混蛋啊！"
38,"TEXT_REGOTH4MYCBWAGI_00694_BWAGI_100_015","你打倒了鬪神一事肯定會迅速傳到各地，<hex:02100103>這樣一來，達爾馬斯卡和納夏的士氣都會大漲，<hex:02100103>反攻作戰也會進行得更加順利！"
39,"TEXT_REGOTH4MYCBWAGI_00694_BWAGI_100_016","但是，大姐頭也說了，<hex:02100103>失去補給和支援的第四軍團為了穩住達爾馬斯卡，<hex:02100103>應該會放棄博茲雅，從這裡撤退才對。"
40,"TEXT_REGOTH4MYCBWAGI_00694_BWAGI_100_017","不過他們把飛空戰艦移動到這裡的舉動徹底推翻了大姐頭的猜想。<hex:02100103>他們之所以會對博茲雅如此執著，<hex:02100103>是不是還有什麼其他原因呢……"
41,"TEXT_REGOTH4MYCBWAGI_00694_BWAGI_100_100","我嗎？<hex:02100103>我正作為前王國火槍手為抵抗組織效命呢。"
42,"TEXT_REGOTH4MYCBWAGI_00694_BWAGI_100_101","畢竟我們都是與第四軍團為敵的同志嘛。<hex:02100103>我會暫時充當博茲雅和達爾馬斯卡之間的聯絡員，<hex:02100103>要承蒙甘戈斯的各位多多關照了！"
43,"TEXT_REGOTH4MYCBWAGI_00694_BWAGI_200_000","怎麼？你對我們邦加族很感興趣嗎？<hex:02100103>對於來自艾歐澤亞的你來說，邦加族確實非常罕見呢。<hex:02100103>既然如此，那我就給你講講吧。"
44,"TEXT_REGOTH4MYCBWAGI_00694_BWAGI_200_001","別看我們全身都覆蓋著這種堅硬的鱗片，<hex:02100103>要是把我們當成爬蟲類的種族的話，那可就大錯特錯了。<hex:02100103>其實，我們和你一樣都是哺乳類的哦，很意外吧？"
45,"TEXT_REGOTH4MYCBWAGI_00694_BWAGI_200_002","這些其實並不是真正的鱗片，<hex:02100103>而是體毛的一部分變成了鱗……<hex:02100103>不對，應該是變成了鱗狀的皮膚才對。"
46,"TEXT_REGOTH4MYCBWAGI_00694_BWAGI_200_003","所以呢，我們邦加族並非卵生，<hex:02100103>而是由母親孕育生產出來的。<hex:02100103>……你那是什麼眼神？嘁，信不信由你！"
47,"TEXT_REGOTH4MYCBWAGI_00694_BWAGI_200_004","人族的壽命大致是50到80歲，<hex:02100103>邦加族則能活100到160歲，<hex:02100103>所以壽命大約是人類的2倍。"
48,"TEXT_REGOTH4MYCBWAGI_00694_BWAGI_200_005","從生物學角度來說，邦加族15歲左右就算是成年了。<hex:02100103>成年後，每年一次的脫皮就會變成4到5年一次……<hex:02100103>你果然還是認為我們是爬蟲類吧？！少把我們混為一談！"
49,"TEXT_REGOTH4MYCBWAGI_00694_BWAGI_200_006","還有，邦加族的嗅覺和聽覺比人類優秀，<hex:02100103>身體的運動能力也更強一些。<hex:02100103>不過由於聲帶很特殊，所以正如你聽到的，我的聲音……"
50,"TEXT_REGOTH4MYCBWAGI_00694_BWAGI_200_007","還有個比較丟人的事，就是邦加族不擅長詠唱魔法。<hex:02100103>越高等的魔法，詠唱起來就越複雜不是嗎？<hex:02100103>所以邦加族中能使用魔法的傢伙非常稀少。"
51,"TEXT_REGOTH4MYCBWAGI_00694_BWAGI_200_008","哦對了，關於膚色代表著氏族這一點，<hex:02100103>由於現在混血越來越多，膚色其實早就已經沒有意義了。<hex:02100103>不過我還是給你講解一下吧。"
52,"TEXT_REGOTH4MYCBWAGI_00694_BWAGI_200_009","黃褐色皮膚代表「魯古阿」，青銅色皮膚代表「伐斯」，<hex:02100103>赤褐色皮膚代表「比斯塔」，灰鐵色皮膚則代表「桑迦」……<hex:02100103>應該是這四種分類，不過由於現在混血越來越……我就不重覆了。"
53,"TEXT_REGOTH4MYCBWAGI_00694_BWAGI_200_010","怎麼樣，是不是對邦加族了解多了？<hex:02100103>可千萬別再叫我們蜥蜴了！<hex:02100103>知道了嗎？！"
54,"TEXT_REGOTH4MYCBWAGI_00694_BWAGI_300_000","バッガモナンの兄貴から受け継いだ小型飛空艇のことサ。<hex:02100103>王都ラバナスタへ移動する時に乗せたことあったヨナ？<hex:02100103>ほら……フランの姐禦に會うために乗ったダロ？"
55,"TEXT_REGOTH4MYCBWAGI_00694_BWAGI_300_001","オレたちが空賊やってた時代に手に入れた飛空艇でナ……<hex:02100103>マァ、義兄貴がウルダハの金持ちから賭けで奪ったンダガ、<hex:02100103>オレやリノが改造を重ねて、そりゃ速ェったらありゃシネェヨ。"
56,"TEXT_REGOTH4MYCBWAGI_00694_BWAGI_300_002","「イウサール」は古代ダルマスカ語で「竜巻」を意味するンだ。<hex:02100103>……ダルマスカでは「じゃじゃ馬」のことをそう揶揄するンダガ、<hex:02100103>あの飛空艇もピーキーなセッティングでナ……いや、繊細なのサ。"
57,"TEXT_REGOTH4MYCBWAGI_00694_BWAGI_300_003","もう何年も乗ってきたからナ、たしかに愛著はあるナァ……<hex:02100103>言ってみればオレたちのホームみたいなモンだからナ。<hex:02100103>良いときも悪いときもオレたちはこの飛空艇と一緒ダッタ。"
58,"TEXT_REGOTH4MYCBWAGI_00694_BWAGI_300_004","ダルマスカ・レジスタンスに參加した時、提供を申し出たンダガ、<hex:02100103>フランの姐禦がそのままオレたちが使えッテナ……<hex:02100103>「バッガモナン組にはそのままでいろ」ッテサ……。"
59,"TEXT_REGOTH4MYCBWAGI_00694_BWAGI_300_005","今回の作戦でイウサール號が壊れたとしても構わない……<hex:02100103>少なくともオレはそう考えているンダ。<hex:02100103>そのためにこの飛空艇が生き殘ったンダナッテ、考えるダケサ。"
60,"TEXT_REGOTH4MYCBWAGI_00694_BWAGI_300_006","「川の流れには逆らうな、それを拒む者は、掌を知らない」<hex:02100103>運命には逆らうな、逆らう者は己の非力さを知らない者だ……<hex:02100103>ダルマスカに伝わる格言のようなもんダ。"
61,"TEXT_REGOTH4MYCBWAGI_00694_BWAGI_300_007","こうやって、このボズヤでアンタと肩を並べて命を懸ける……<hex:02100103>それがオレたちの運命なのだとしたら、こんな素敵なことはナイ。<hex:02100103>オレは運命を信じてその流れに乗るだけサ。"
62,"TEXT_REGOTH4MYCBWAGI_00694_TALK_ACTOR","（★未使用／削除予定★）"
