key,0,1,2,3,4,5,6,7,8,9,10,11,12,13,14,15,16,17,18,19,20,21,22,23,24,25,26,27,28,29,30,31,32,33,34,35,36,37,38,39,40,41
#,,,,,,,,,,,,,,,,,,,,,,,,,,,,,,,,,,,,,Talk[0],Talk[1],Talk[2],Talk[3],Talk[4],Talk[5]
offset,11,23,35,47,59,71,8,20,32,44,56,68,0,12,24,36,48,60,9,21,33,45,57,69,10,22,34,46,58,70,4,16,28,40,52,64,72,76,80,84,88,92
int32,bit&01,bit&01,bit&01,bit&01,bit&01,bit&01,byte,byte,byte,byte,byte,byte,uint32,uint32,uint32,uint32,uint32,uint32,sbyte,sbyte,sbyte,sbyte,sbyte,sbyte,sbyte,sbyte,sbyte,sbyte,sbyte,sbyte,int32,int32,int32,int32,int32,int32,str,str,str,str,str,str
0,False,False,False,False,False,False,0,0,0,0,0,0,0,0,0,0,0,0,0,0,0,0,0,0,0,0,0,0,0,0,0,0,0,0,0,0,"0","0","0","0","0","0"
1,False,False,False,False,False,False,2,0,0,0,0,0,0,0,0,0,0,0,0,0,0,0,0,0,0,0,0,0,0,0,3,4,0,0,0,0,"帶來了嗎？","謝謝！","哦……真遺憾……","0","0","0"
2,False,False,False,False,False,False,0,0,0,0,0,0,0,0,0,0,0,0,0,0,0,0,0,0,0,0,0,0,0,0,0,0,0,0,0,0,"我的委託完成了？","太好了！","還沒有嗎……","還能再多給我點嗎？","那到時候再和我說一下吧！","已經足夠了！非常感謝你！"
3,True,True,True,True,True,True,2,2,2,2,2,2,0,0,0,0,0,0,0,0,0,0,0,0,0,0,0,0,0,0,1,1,1,1,1,1,"你就是接下了任務的工匠吧？委託的物品完成了嗎？<hex:02100103>我知道你們冒險者都很忙，不過我這邊也有壓力啊。","太謝謝了！<hex:02100103>看上去質量很不錯嘛，你的手藝還真不一般。<hex:02100103>給，這是委託的報酬。","好吧……看來你也盡力了……<hex:02100103>我還以為用理符來進行委託會有好結果呢。","0","0","0"
4,True,True,True,True,True,True,2,2,2,2,2,2,0,0,0,0,0,0,0,0,0,0,0,0,0,0,0,0,0,0,1,1,1,1,1,1,"哦？你就是公會派來的冒險者工匠嗎？<hex:02100103>我等你好久了，委託的物品都準備好了嗎？","太好了！多謝你的幫忙。<hex:02100103>這裡是一點心意，應該對你會有所幫助。","是嗎……太遺憾了……<hex:02100103>沒關係，還有些時間，我也不希望看到你趕工導致質量下降的結果。","0","0","0"
5,True,True,True,True,True,True,2,2,2,2,2,2,0,0,0,0,0,0,0,0,0,0,0,0,0,0,0,0,0,0,1,1,1,1,1,1,"您就是之前聯繫過來的工匠師傅吧。<hex:02100103>繁星預示了您的到來，請問委託物品準備得如何了？","真是出色的做工啊，出自您手的成品果然毫無問題。<hex:02100103>那麼我就收下了，這裡是對您的感謝之禮。","嗯……是這樣嗎……<hex:02100103>如果有什麼為難之處請儘管開口，<hex:02100103>我們會提供相應的幫助。","另外，這位師傅，<hex:02100103>我這裡還有些追加的委託……<hex:02100103>您能繼續嗎？","好吧，看來您也有很多不方便的情況。<hex:02100103>等有空餘之時還請來通告一聲。","真是萬分感謝。"
6,True,True,True,True,True,True,2,2,2,2,2,2,0,0,0,0,0,0,0,0,0,0,0,0,0,0,0,0,0,0,1,1,1,1,1,1,"你終於來了！<hex:02100103>我們跳過客套話時間吧，給我看看你的成果。","看來還不錯麼。我就知道你不會讓我失望。<hex:02100103>給你，這是你的報酬。","那就快去做啊！<hex:02100103>做完之後再過來吧，閒談就免了。","我這裡還有些追加委託，有興趣麼？<hex:02100103>對你來說應該是小菜一碟了，怎麼樣？","好吧，想好了就隨時來找我。<hex:02100103>不過其他什麼雜七雜八的事我可沒興趣。","多謝了。<hex:02100103>能起到作用的冒險者都是好傢伙，隨時過來吧。"
7,True,True,True,True,True,True,2,2,2,2,2,2,0,0,0,0,0,0,0,0,0,0,0,0,0,0,0,0,0,0,1,1,1,1,1,1,"原來是你領取了我們隊委託的理符任務啊。<hex:02100103>先對你的協力表示感謝。<hex:02100103>那麼就請將委託的物品交來吧。","嗯……確實是我們所委託的物品。<hex:02100103>質量相當不錯，真是太漂亮了。<hex:02100103>我代表我們全體隊員向你表示感謝。","什麼？還沒有準備好？<hex:02100103>我們全隊都急需那些物品。<hex:02100103>你多拖延一秒我們就多一秒危險。","0","0","0"
8,True,True,True,True,True,True,2,2,2,2,2,2,0,0,0,0,0,0,0,0,0,0,0,0,0,0,0,0,0,0,1,1,1,1,1,1,"你就是<hex:022903EB0203>吧？你的事跡我早有耳聞。<hex:02100103>閒話少說，步入正題吧。","很好，符合我的要求。<hex:02100103>我很滿意，<hex:022903EB0203>。<hex:02100103>我們商會向來守信，會支付給你相應的報酬的。","不論你用什麼方法，<hex:02100103>請盡快準備好我需要的東西。","嗯，的確手藝精湛。<hex:02100103>看在這手藝的份上，我就再追加點委託吧。<hex:02100103>你不會拒絕的吧？","……那算了。<hex:02100103>以現在的數量，起碼夠用了。","我很滿意，<hex:022903EB0203>。<hex:02100103>我們商會向來守信，<hex:02100103>你很能幹，我記住你了。"
9,True,True,True,True,True,True,2,2,2,2,2,2,0,0,0,0,0,0,0,0,0,0,0,0,0,0,0,0,0,0,1,1,1,1,1,1,"你就是冒險者公會派來的吧？<hex:02100103>快把委託品交給我吧。","嗯，這的確是我所委託的物品。<hex:02100103>沒問題，我會給你應得的報酬的。<hex:02100103>以後再來接我的委託啊。","怎麼了？你忘了帶委託品了麼？<hex:02100103>那就趕緊回去取。","0","0","0"
10,True,True,True,True,True,True,2,2,2,2,2,2,0,0,0,0,0,0,0,0,0,0,0,0,0,0,0,0,0,0,1,1,1,1,1,1,"你接了我的公會理符任務？<hex:02100103>那你肯定很有本事吧？","不錯，不錯。<hex:02100103>我又能賺一筆了。<hex:02100103>下次還要再接我的委託啊，夥計。","喂喂，還沒做好麼？<hex:02100103>既然有工夫在這破殖民地閒逛，<hex:02100103>還不趕快去完成我的委託！","0","0","0"
11,True,True,True,True,True,True,2,2,2,2,2,2,0,0,0,0,0,0,0,0,0,0,0,0,0,0,0,0,0,0,1,1,1,1,1,1,"哎呀，你就是<hex:022903EB0203>吧？<hex:02100103>我是「冰靈公主號」的船長赫·蘭博羅。<hex:02100103>我等你好久了！","簡直太完美了，<hex:022903EB0203>！<hex:02100103>你別當什麼寒酸的冒險者了，乾脆來我船上吧。<hex:02100103>我會好好疼愛你的。","你記住委託內容了麼？<hex:02100103>那就拜託你啦。<hex:02100103>別擔心報酬問題，海上巾幗絕對守信。","你真能幹啊，<hex:022903EB0203>！<hex:02100103>我還想委託給你一份工作。<hex:02100103>別擔心報酬問題，海上巾幗絕對守信。","哎呀，你有別的事麼？<hex:02100103>那就算了，誰讓這是我突然拜託你的呢。","簡直太完美了，<hex:022903EB0203>！<hex:02100103>我真想邀請你來我們船上。<hex:02100103>你要是對冒險膩了，就來找我吧！"
12,True,True,True,True,True,True,2,2,2,2,2,2,0,0,0,0,0,0,0,0,0,0,0,0,0,0,0,0,0,0,1,1,1,1,1,1,"你是接受了公會理符任務的人吧？<hex:02100103>那麼我們馬上步入正題。","我收下了。<hex:02100103>有了這些就足夠了。<hex:02100103>今後也要請你多幫忙。","……委託品呢？<hex:02100103>你不會還沒做吧？","你很能幹，<hex:02100103>我能再委託你一件事麼？<hex:02100103>當然了，我會付給你相應的報酬的。","我明白了，冒險者也是很忙的嘛。","我收下了。<hex:02100103>有了這些，我的主人格格魯玖肯定會滿意的。"
13,True,True,True,True,True,True,2,2,2,2,2,2,0,0,0,0,0,0,0,0,0,0,0,0,0,0,0,0,0,0,1,1,1,1,1,1,"你就是<hex:022903EB0203>吧？<hex:02100103>等候多時啦。<hex:02100103>快來談生意上的事吧。","太棒了，<hex:022903EB0203>！真是超乎了我的想象。<hex:02100103>請你以後也與我們阿修加納貿易部隊合作吧。","我可是特意花錢讓冒險者公會介紹你過來的，<hex:02100103>你可別辜負了我的期待啊。","太棒了<hex:022903EB0203>！<hex:02100103>我想再追加點委託，<hex:02100103>怎樣，你肯接受麼？","是這樣啊……真遺憾。<hex:02100103>那貿易就此結束吧。<hex:02100103>下次如果有機會，還請你多幫忙。","太棒了<hex:022903EB0203>！<hex:02100103>簡直超乎了我的想象！<hex:02100103>我會給你豐厚的報酬的！"
14,True,True,True,True,True,True,2,2,2,2,2,2,0,0,0,0,0,0,0,0,0,0,0,0,0,0,0,0,0,0,1,1,1,1,1,1,"你好！做好委託品了嗎？<hex:02100103>你肯定給我帶來了吧？","謝謝，這的確是我委託的東西。<hex:02100103>這是你的報酬。","怎麼了？<hex:02100103>難道你忘了我委託了什麼嗎？","0","0","0"
15,True,True,True,True,True,True,2,2,2,2,2,2,0,0,0,0,0,0,0,0,0,0,0,0,0,0,0,0,0,0,1,1,1,1,1,1,"哎呀，你有什麼事麼？<hex:02100103>有東西要給我？","我收下了。<hex:02100103>這是你的報酬，辛苦了。","你不會是把貨物扔在半路上，自己逃過來了吧？<hex:02100103>快點把東西給我！","0","0","0"
16,True,True,True,True,True,True,2,2,2,2,2,2,0,0,0,0,0,0,0,0,0,0,0,0,0,0,0,0,0,0,1,1,1,1,1,1,"你真的是工匠？<hex:02100103>不會是蜥蜴人派來的間諜吧？","這是……太好了！<hex:02100103>自從我轉行當商人，可沒少被人騙……<hex:02100103>抱歉剛才懷疑了你，謝謝。","哼，你完成不了委託，但又想表達你的誠意，<hex:02100103>所以才到這營地來……<hex:02100103>我會信你麼？","那個……我能再追加個委託麼？<hex:02100103>拜託了，我只相信你一個！","不再接新委託了麼？<hex:02100103>你好歹也是個工匠吧？","幫我大忙了！<hex:02100103>果然信你是對的……<hex:02100103>這世上還是有可信的人的呀！"
17,True,True,True,True,True,True,2,2,2,2,2,2,0,0,0,0,0,0,0,0,0,0,0,0,0,0,0,0,0,0,1,1,1,1,1,1,"0","0","0","0","0","0"
18,True,True,True,True,True,True,2,2,2,2,2,2,0,0,0,0,0,0,0,0,0,0,0,0,0,0,0,0,0,0,1,1,1,1,1,1,"你是公會派來的冒險者吧？<hex:02100103>是來接我的工作的？<hex:02100103>讓你跑到這麼冷的地方來，真是辛苦你了。","沒錯，我訂的就是這些。<hex:02100103>這樣就能繼續做生意了。<hex:02100103>這裡可真冷……","快把我訂的東西拿來……<hex:02100103>讓我在這麼冷的地方等，實在太考驗耐力了。<hex:02100103>唔唔，好冷啊……","沒錯，我訂的就是這些。<hex:02100103>不過，要是你能再給我提供點就更好了……<hex:02100103>能再去幫我跑一趟嗎？","是麼，那就算了。<hex:02100103>反正這些也夠用了。<hex:02100103>再說，這裡這麼冷……我不會勉強你的。","真是幫了我大忙了。<hex:02100103>不枉我在這麼冷的地方等你。<hex:02100103>這下就能買厚厚的毛皮大衣了。"
19,True,True,True,True,True,True,2,2,2,2,2,2,0,0,0,0,0,0,0,0,0,0,0,0,0,0,0,0,0,0,1,1,1,1,1,1,"你就是那個接了我的委託的冒險者吧？<hex:02100103>那就拜託你了。","……嗯，真不錯。<hex:02100103>只要有了它，我就能小賺一筆了。<hex:02100103>把這事托給冒險者公會，真是個正確的選擇。","我已經把錢付給冒險者公會了。<hex:02100103>希望你能把我訂的東西送來。<hex:02100103>拜託了。","你幹得真不錯。<hex:02100103>能不能再幫我送點來……<hex:02100103>當然了，我會付報酬的。","看來你沒空啊。<hex:02100103>沒辦法，誰讓是我突然拜託你的呢。<hex:02100103>不夠用的我會想辦法補上的，辛苦你了。","真是幫我大忙了！謝謝！<hex:02100103>只要有了這些，我的日子就好過多了。"
20,True,True,True,True,True,True,2,2,2,2,2,2,0,0,0,0,0,0,0,0,0,0,0,0,0,0,0,0,0,0,1,1,1,1,1,1,"你就是那個接了我們委託的冒險者吧？<hex:02100103>等候多時了。","我們訂的就是這些。<hex:02100103>我代表聖寇伊納克財團感謝你。<hex:02100103>謝謝你幫我們的忙。","還記得我們都訂了什麼嗎？<hex:02100103>都是一些調查時必需的東西，拜託你了。","你按訂單交貨了啊，<hex:02100103>如果你還有時間，能不能再多幫我送來點？","對不起，冒險者也是很忙的，這我明白。<hex:02100103>那以後有機會我們再合作吧。","你做得真棒！<hex:02100103>請允許我代表聖寇伊納克財團對你表示感謝。<hex:02100103>謝謝你幫我們的忙。"
21,True,True,True,True,True,True,2,2,2,2,2,2,0,0,0,0,0,0,0,0,0,0,0,0,0,0,0,0,0,0,1,1,1,1,1,1,"你就是那個接了我的委託的捕魚人吧？<hex:02100103>捕到我想要的魚了嗎？","噢噢！就是它！<hex:02100103>我想用它來創作一道菜。<hex:02100103>謝謝啦，幫我大忙了。","喂喂，還沒捕來嗎？<hex:02100103>魚不鮮可就不好吃了。<hex:02100103>完成委託也一樣，要求的也是一個快字。","對了，你能不能再幫我捕來一些？","是麼……<hex:02100103>看來你也很忙啊，<hex:02100103>算了，別在意。","你幫我帶來了啊！<hex:02100103>有了這些食材，我就能創作出新菜餚了。<hex:02100103>謝謝你。"
22,True,True,True,True,True,True,2,2,2,2,2,2,0,0,0,0,0,0,0,0,0,0,0,0,0,0,0,0,0,0,1,1,1,1,1,1,"你就是冒險者公會派來的捕魚人？<hex:02100103>你幫我捕到我想要的魚了嗎？","嗯嗯，你沒私吞掉貨物，<hex:02100103>把我訂的東西送來啦！<hex:02100103>這些是說好的報酬。","你還沒去捕魚嗎？<hex:02100103>你可別因為捕到的魚好吃，就把它們私吞了啊！","真棒！我都想再托你幫我捕幾條了。<hex:02100103>當然了，會給你可觀的報酬的。","是麼……<hex:02100103>我理解，捕魚人也是很忙的嘛。<hex:02100103>以後有機會再合作吧。","謝謝你！<hex:02100103>這是報酬，請收好。"
23,True,True,True,True,True,True,2,2,2,2,2,2,0,0,0,0,0,0,0,0,0,0,0,0,0,0,0,0,0,0,1,1,1,1,1,1,"就是你接下了我的委託？<hex:02100103>嘻嘻，我等著你幫我捕魚回來哦。","哇！你真的捕來了啊！<hex:02100103>謝謝！","嘻嘻，我會等你捕魚回來的。","嘻嘻，你真是可靠。<hex:02100103>能不能請你繼續去完成個追加委託啊？","是這樣啊……<hex:02100103>真遺憾。<hex:02100103>我就先用著你捕來的這些吧。","哇！你真幫我捕來了啊？！<hex:02100103>謝謝！<hex:02100103>我會多給你些報酬的！"
24,True,True,True,True,True,True,2,2,2,2,2,2,0,0,0,0,0,0,0,0,0,0,0,0,0,0,0,0,0,0,1,1,1,1,1,1,"你就是冒險者公會派來的捕魚人吧？<hex:02100103>準備好我訂的東西了嗎？","謝謝。<hex:02100103>真是幫了我大忙了。<hex:02100103>這樣我就不會被別人說是廢物捕魚人了。","我托你的東西準備好了麼？<hex:02100103>能不能快點啊？","我能再托你幫我捕點嗎？","我就知道你不會這麼簡單就答應的。<hex:02100103>算了，我也不是第一次被別人冷漠對待了。","啊，真是不知道怎麼感謝你才好了！<hex:02100103>我會多給你些報酬的！"
25,True,True,True,True,True,True,2,2,2,2,2,2,0,0,0,0,0,0,0,0,0,0,0,0,0,0,0,0,0,0,1,1,1,1,1,1,"你就是接了委託的捕魚人吧？<hex:02100103>已經準備好我訂的東西了嗎？","我收下了。<hex:02100103>這樣就能讓格格魯玖滿意了。<hex:02100103>請收下報酬吧。","看樣子，你還沒準備好我訂的東西啊。<hex:02100103>能不能請你馬上出港捕魚？","我看中你的技術，<hex:02100103>想再托你幫我捕點魚……<hex:02100103>你能考慮一下嗎？","是這樣啊……<hex:02100103>不過既然上次訂的你已經交貨了，<hex:02100103>那就算了，謝謝。","謝謝你再次幫我。<hex:02100103>那麼我就連追加委託的報酬一起付給你。"
26,True,True,True,True,True,True,2,2,2,2,2,2,0,0,0,0,0,0,0,0,0,0,0,0,0,0,0,0,0,0,1,1,1,1,1,1,"感謝你接受我的委託。<hex:02100103>你帶來我訂的東西了嗎？","謝謝。<hex:02100103>把這事托給冒險者公會，真是個正確的選擇。<hex:02100103>這是說好的報酬，請收下。","你帶來我訂的東西了嗎？<hex:02100103>能不能請你快點去準備……","幫了我大忙了，謝謝你。<hex:02100103>話說，我想再多訂一些，可以嗎？","是麼……真遺憾。<hex:02100103>你不用感到內疚，<hex:02100103>我會自己想辦法解決的。","托你辦了這麼多事，真是感謝你。<hex:02100103>我會付給你相應的報酬的。"
27,True,True,True,True,True,True,2,2,2,2,2,2,0,0,0,0,0,0,0,0,0,0,0,0,0,0,0,0,0,0,1,1,1,1,1,1,"你就是接了我的委託的冒險者？<hex:02100103>感謝你為了我來到這寒冷的白雲崖。<hex:02100103>你帶來我訂的東西了嗎？","我就等它呢！<hex:02100103>多虧了你們捕魚人，我們才能有生意做。","看樣子你還沒準備好我訂的東西啊。<hex:02100103>雖然這裡很冷，但也請你加把勁啊。","你真勤勞，我很佩服你。<hex:02100103>能不能再答應我件事？<hex:02100103>我想再多訂一些……","唔……那好吧，<hex:02100103>我再想別的辦法吧。","你真勤勞，我很佩服你。<hex:02100103>不光佩服，我還會多給你些報酬的。"
28,True,True,True,True,True,True,2,2,2,2,2,2,0,0,0,0,0,0,0,0,0,0,0,0,0,0,0,0,0,0,1,1,1,1,1,1,"你是冒險者公會的捕魚人吧？<hex:02100103>是來給我送東西的麼？","嗯，我收下了。<hex:02100103>這工作能由你來做，<hex:02100103>真是幫了我大忙。","我訂的東西呢？<hex:02100103>還以為你是來交貨的呢……","你真是個技術過硬的捕魚人，<hex:02100103>我想再請你為我多捕點魚……","……你不願意我也不會強求。<hex:02100103>我再想別的辦法吧。","看來找你是個正確的選擇。<hex:02100103>有這些就足夠了。<hex:02100103>我會多給你些報酬的。"
29,True,True,True,True,True,True,2,2,2,2,2,2,0,0,0,0,0,0,0,0,0,0,0,0,0,0,0,0,0,0,1,1,1,1,1,1,"你就是接下了委託的工匠呀。<hex:02100103>請盡快把東西做出來吧。","真是相當不錯……<hex:02100103>符合我訂單上的所有要求，我很滿意。","你好像並沒有我要的東西……<hex:02100103>請盡快把東西做出來吧。","真是相當不錯……<hex:02100103>想不想接下我的追加訂單？<hex:02100103>當然報酬也會給你增加的。","唔，你有別的事要忙呀。<hex:02100103>那就沒辦法了，我們有機會再合作吧。","這下總算湊齊足夠的數量了！<hex:02100103>非常感謝，真是幫大忙了！"
30,True,True,True,True,True,True,2,2,2,2,2,2,0,0,0,0,0,0,0,0,0,0,0,0,0,0,0,0,0,0,1,1,1,1,1,1,"你就是接下了委託的捕魚人吧？<hex:02100103>可以把東西交給我了嗎？","這就是我訂的東西沒錯。<hex:02100103>你的工作完成得非常出色，請收下這份報酬。","咦，你好像沒有帶來我訂的東西。","看來你的技術相當不錯。<hex:02100103>如果方便的話我希望能追加訂單……","真遺憾。<hex:02100103>那我找其他捕魚人試試吧。","非常感謝，你幹得漂亮極了。<hex:02100103>我會如約為你追加報酬的。"
31,True,True,True,True,True,True,2,2,2,2,2,2,0,0,0,0,0,0,0,0,0,0,0,0,0,0,0,0,0,0,1,1,1,1,1,1,"如果委託品做好了，就拿到我這裡來吧。<hex:02100103>客人一定也等得很心急。","做得很好啊，難怪你這麼有自信。<hex:02100103>我相信客人一定也會很滿意的。","咦，你好像沒有帶來委託品啊……<hex:02100103>該不會是做好之後忘記帶來了吧？","做得很好啊，我相信客人一定也會很滿意的。<hex:02100103>話說回來，我這裡還有後續的任務……要試試看嗎？<hex:02100103>當然報酬也會追加的。","不好意思啊，讓你為難了。<hex:02100103>等你下次有時間再來幫我吧。","謝謝，有這些就足夠了。<hex:02100103>按照約定，我會多給你一些報酬的。"
32,True,True,True,True,True,True,2,2,2,2,2,2,0,0,0,0,0,0,0,0,0,0,0,0,0,0,0,0,0,0,1,1,1,1,1,1,"你是接受了理符任務的捕魚人嗎？<hex:02100103>如果你捕到了委託品，就交給我吧！","嗯嗯，看來委託品都交齊了。<hex:02100103>辛苦你了，我這就把報酬給你。","嗯嗯，看來委託品都……並沒有交齊啊！<hex:02100103>真是的，拜託你認真一點。","嗯嗯，看來委託品都交齊了。<hex:02100103>話說回來，我這裡還有後續的委託，你有興趣嗎？","哎呀，真遺憾……<hex:02100103>沒辦法，之後我再自己去悄悄捕吧。","十分感謝！<hex:02100103>在你的協助下，我們已經集齊了必要的委託品。<hex:02100103>我會多給你一些報酬的，連帶追加任務的報酬一起！"
33,True,True,True,True,True,True,2,2,2,2,2,2,0,0,0,0,0,0,0,0,0,0,0,0,0,0,0,0,0,0,1,1,1,1,1,1,"委託的物品做好了嗎？<hex:02100103>做好就拿來給我吧！","嗯，很不錯的品質。<hex:02100103>沒有任何問題。","呃，東西在哪？<hex:02100103>你不會是忘記帶來了吧？","嗯，很不錯的品質。<hex:02100103>話說回來，我還想委託你繼續製作，不知你願意嗎？<hex:02100103>當然報酬也會追加的。","這樣啊……那沒事了，就這樣吧。<hex:02100103>畢竟你已經把一開始委託給你的工作完成了！","你真棒！<hex:02100103>好了，收下這些報酬吧！"
34,True,True,True,True,True,True,2,2,2,2,2,2,0,0,0,0,0,0,0,0,0,0,0,0,0,0,0,0,0,0,1,1,1,1,1,1,"你就是接受了理符任務的捕魚人吧？<hex:02100103>如果你捕到了委託品，就交給我吧！","確認已收貨。<hex:02100103>我這就把報酬給你。","啊，好像貨不夠數呀……<hex:02100103>你不會是給扔在漁場沒拿來吧？","確認已收貨。<hex:02100103>話說回來，我還想繼續委託你捕魚，<hex:02100103>報酬也會相應增加的，你意下如何？","啊，你沒時間呀……<hex:02100103>那就算了，我不會強迫你的。","十分感謝！<hex:02100103>追加的部分也收到了！<hex:02100103>我會多給你報酬的！"
