1138,"批發委託：天球儀的追加訂單","我們又接到了為聖岡里奧爾占星院籌備天球儀的委託，據說他們是準備推廣薩雷安式占星術。雖然他們多半無法成為皇都的主流，但還請接下這份委託。",153,6,8,4,56,0,1,0,2300,2300,False,12,182,0,62,80014,918255,True,0,1,1395970,884,366,26,5,5852425,110089,True,0,14
1139,"大規模製作委託：聖具用硬銀","聖雷馬諾大聖堂的儀式用聖具被盜了。為此必須盡快製作出新的聖具替代，但奈何材料不夠了。請為大聖堂製作硬銀錠。",152,6,8,4,56,0,10,0,2300,2300,False,12,182,0,62,80014,918256,True,0,1,4412550,4160,371,18,2,5852425,110089,True,0,14
1140,"大規模製作委託：贈與木工的耳環","我們想贈送裝飾品給澤梅爾家的木匠們，作為協助修復對龍防禦設施的報酬。最好是與木匠們相稱的龍牙耳環，在此請求雕金匠的幫忙。",153,6,8,4,56,0,10,0,2300,2300,False,12,182,0,62,80014,918257,True,0,1,3235870,4160,371,18,2,5852425,110089,True,0,14
1141,"大規模批發委託：天球儀的追加訂單","我們又接到了為聖岡里奧爾占星院籌備天球儀的委託，據說他們是準備推廣薩雷安式占星術。雖然他們多半無法成為皇都的主流，但還請接下這份委託。",153,6,8,4,56,0,10,0,2300,2300,False,12,182,0,62,80014,918258,True,0,1,1861290,1326,376,26,2,5852425,110089,True,0,14
1142,"製作委託：女獵人的獎賞","在龍族襲擊運輸部隊時，有一位女獵人從遠方放箭射穿了龍族的眼睛，成功擊退了龍族。為了表彰她的英勇與實力，請求雕金匠製作一枚美麗的戒指。",153,6,8,4,58,0,1,0,2300,2300,False,12,182,0,62,80014,918259,True,0,1,852760,988,362,18,5,5852425,110089,True,0,14
1143,"製作委託：贈與資助者的紀念品","有一位貴婦人對我神殿騎士團進行了很多資助。因為她是出了名的善於刺繡，我們想準備一套最高級的縫衣針贈與她作紀念。<hex:02100103><hex:02100103><hex:024804F201F403><hex:024904F201F503>要製作為完成本理符所需的物品，需要習得雕金秘籍第三卷。<hex:0249020103><hex:0248020103>",153,6,8,4,58,0,1,0,2300,2300,False,12,182,0,62,80014,918260,True,0,1,1144360,1040,362,18,5,5852425,110089,True,0,14
1144,"批發委託：新任醫師的頭冠","新一批醫師加入了我神殿騎士團的醫院。為了表彰他們的獻身精神，我們想贈送一批可提高魔力的頭冠給他們。請求手藝高超的雕金匠協助。<hex:02100103><hex:02100103><hex:024804F201F403><hex:024904F201F503>要製作為完成本理符所需的物品，需要習得雕金秘籍第三卷。<hex:0249020103><hex:0248020103>",154,6,8,4,58,0,1,0,2300,2300,False,12,182,0,62,80014,918261,True,0,1,1428840,1040,367,26,5,5852425,110089,True,0,14
1145,"大規模製作委託：女獵人的獎賞","在龍族襲擊運輸部隊時，有一位女獵人從遠方放箭射穿了龍族的眼睛，成功擊退了龍族。為了表彰她的英勇與實力，請求雕金匠製作一枚美麗的戒指。",153,6,8,4,58,0,10,0,2300,2300,False,12,182,0,62,80014,918262,True,0,1,4690220,4940,372,18,2,5852425,110089,True,0,14
1146,"大規模製作委託：贈與資助者的紀念品","有一位貴婦人對我神殿騎士團進行了很多資助。因為她是出了名的善於刺繡，我們想準備一套最高級的縫衣針贈與她作紀念。<hex:02100103><hex:02100103><hex:024804F201F403><hex:024904F201F503>要製作為完成本理符所需的物品，需要習得雕金秘籍第三卷。<hex:0249020103><hex:0248020103>",153,6,8,4,58,0,10,0,2300,2300,False,12,182,0,62,80014,918263,True,0,1,6294020,5200,372,18,2,5852425,110089,True,0,14
1147,"大規模批發委託：新任醫師的頭冠","新一批醫師加入了我神殿騎士團的醫院。為了表彰他們的獻身精神，我們想贈送一批可提高魔力的頭冠給他們。請求手藝高超的雕金匠協助。<hex:02100103><hex:02100103><hex:024804F201F403><hex:024904F201F503>要製作為完成本理符所需的物品，需要習得雕金秘籍第三卷。<hex:0249020103><hex:0248020103>",154,6,8,4,58,0,10,0,2300,2300,False,12,182,0,62,80014,918264,True,0,1,1905120,1560,377,26,2,5852425,110089,True,0,14
1148,"採集確認：地方病特效藥的材料","近年有一種有著嘔血症狀的地方病有要流行開來的趨勢。雖然暫時被特效藥壓了下去，但如果藥的庫存見底的話就大事不妙了。請採集作為特效藥原材料的紅玉草根。",154,3,3,4,50,20,1,1,2204,2300,False,18,188,0,2200,80014,131160,True,1,81,0,834,468,14,5,5581915,110090,True,5912171,67
1149,"指定採集：聖瓦勒魯瓦揚的頭冠","紀念曾經傳說中的蒼天之龍騎士聖瓦勒魯瓦揚的節日就快到了。在那一天，有著神殿騎士團為皇都的小孩子們發放聖人草編織的頭冠的習俗。請為我們採集編織頭冠的材料。",152,3,3,4,50,20,1,1,2204,2300,False,18,188,0,2200,80014,131161,True,1,90,0,834,468,29,5,5581915,110090,True,5912173,67
1150,"強行採集：新的採伐候選地","澤梅爾家正在對隼巢進行要塞化工程建設，今後他們將面臨缺少木材的問題。請前往候選的採伐地採集適合建材用的原木與助燃用的柴木樣本進行調查。",151,3,3,4,50,20,1,1,2204,2300,False,18,188,0,2200,80014,131162,True,1,61,0,769,468,25,5,5581915,110090,True,5912174,67
1151,"大規模採集確認：地方病特效藥的材料","近年有一種有著嘔血症狀的地方病有要流行開來的趨勢。雖然暫時被特效藥壓了下去，但如果藥的庫存見底的話就大事不妙了。請採集作為特效藥原材料的紅玉草根。",154,3,3,4,50,20,10,1,2204,2300,False,18,188,0,2200,80014,131163,True,1,365,0,4994,473,14,2,5581915,110090,True,5912171,67
1152,"大規模指定採集：聖瓦勒魯瓦揚的頭冠","紀念曾經傳說中的蒼天之龍騎士聖瓦勒魯瓦揚的節日就快到了。在那一天，有著神殿騎士團為皇都的小孩子們發放聖人草編織的頭冠的習俗。請為我們採集編織頭冠的材料。",152,3,3,4,50,20,10,1,2204,2300,False,18,188,0,2200,80014,131164,True,1,401,0,4669,473,29,2,5581915,110090,True,5912173,67
1153,"大規模強行採集：新的採伐候選地","澤梅爾家正在對隼巢進行要塞化工程建設，今後他們將面臨缺少木材的問題。請前往候選的採伐地採集適合建材用的原木與助燃用的柴木樣本進行調查。",151,3,3,4,50,20,10,1,2204,2300,False,18,188,0,2200,80014,131165,True,1,274,0,4669,473,25,2,5581915,110090,True,5912174,67
1154,"採集確認：儲備藥用龍膽","維持醫院的運營是神殿騎士團的重要使命之一。庫爾札斯地區的氣候變冷導致了藥草的產量下降。請前往相對危險的陸行鳥之森，採集能作為胃藥材料的龍膽。",154,3,3,4,52,20,1,1,2018,2300,False,18,188,0,2000,80014,131166,True,1,77,0,1062,469,14,5,5581915,110091,True,5912185,67
1155,"大量採集：對龍毒藥研究的實驗材料","我們正在協助本草學者馬蒂諾先生研究對龍用毒藥。據說有種野草龍族絕不會放入口中。為了嘗試從中提取出毒素，我們需要很多實驗材料。請採伐大量的利克瓦茲草。",151,3,3,4,52,20,1,1,2018,2300,False,18,188,0,2000,80014,131167,True,1,85,0,932,469,15,5,5581915,110091,True,5912187,67
1156,"指定採集：七天樹的根","我們想請人採伐生長在陸行鳥之森的七天樹根。聽說這種材料輕盈並有一定的防水特性。我們想把它送到天鋼機工房看看這種材料能不能給一直出問題的新型飛空艇做船身。",151,3,3,4,52,20,1,1,2018,2300,False,18,188,0,2000,80014,131168,True,1,85,0,932,469,29,5,5581915,110091,True,5912188,67
1157,"大規模採集確認：儲備藥用龍膽","維持醫院的運營是神殿騎士團的重要使命之一。庫爾札斯地區的氣候變冷導致了藥草的產量下降。請前往相對危險的陸行鳥之森，採集能作為胃藥材料的龍膽。",154,3,3,4,52,20,10,1,2018,2300,False,18,188,0,2000,80014,131169,True,1,347,0,5092,474,14,2,5581915,110091,True,5912185,67
1158,"大規模大量採集：對龍毒藥研究的實驗材料","我們正在協助本草學者馬蒂諾先生研究對龍用毒藥。據說有種野草龍族絕不會放入口中。為了嘗試從中提取出毒素，我們需要很多實驗材料。請採伐大量的利克瓦茲草。",151,3,3,4,52,20,10,1,2018,2300,False,18,188,0,2000,80014,131170,True,1,382,0,6392,474,15,2,5581915,110091,True,5912187,67
1159,"大規模指定採集：七天樹的根","我們想請人採伐生長在陸行鳥之森的七天樹根。聽說這種材料輕盈並有一定的防水特性。我們想把它送到天鋼機工房看看這種材料能不能給一直出問題的新型飛空艇做船身。",151,3,3,4,52,20,10,1,2018,2300,False,18,188,0,2000,80014,131171,True,1,382,0,5417,474,29,2,5581915,110091,True,5912188,67
1160,"採集確認：新藥研發用樣本","聽聞通往翻雲霧海的航路被拓展開了，神殿騎士團總部一下子就來精神了。請前往翻雲霧海看看有沒有能派上用場的野草並採伐一些樣本回來。如果能研究出新藥的話，將會拯救很多生命。",154,3,3,4,54,20,1,1,2042,2300,False,18,188,0,2002,80014,131172,True,1,72,0,1097,470,14,5,5581915,110093,True,5912193,67
1161,"指定採集：古代藥草蒲公英","根據神殿騎士團所保管的文獻記載，龍族的根據地有一種名為蒲公英的藥草。我們想對這種也能充作藥茶材料的藥草進行研究，請進入危險區域進行採伐。",154,3,3,4,54,20,1,1,2042,2300,False,18,188,0,2002,80014,131173,True,1,80,0,1032,470,29,5,5581915,110093,True,5912194,67
1162,"強行採集：龍族食用的野草","知己知彼，百戰百勝。為了調查龍族的生態，我們想請人採集翻雲霧海生長的野草。最好是龍族或龍族眷屬會吃的野草。",151,3,3,4,54,20,1,1,2042,2300,False,18,188,0,2002,80014,131174,True,1,54,0,772,470,25,5,5581915,110093,True,5912195,67
1163,"大規模採集確認：新藥研發用樣本","聽聞通往翻雲霧海的航路被拓展開了，神殿騎士團總部一下子就來精神了。請前往翻雲霧海看看有沒有能派上用場的野草並採伐一些樣本回來。如果能研究出新藥的話，將會拯救很多生命。",154,3,3,4,54,20,10,1,2042,2300,False,18,188,0,2002,80014,131175,True,1,324,0,4802,475,14,2,5581915,110093,True,5912193,67
1164,"大規模指定採集：古代藥草蒲公英","根據神殿騎士團所保管的文獻記載，龍族的根據地有一種名為蒲公英的藥草。我們想對這種也能充作藥茶材料的藥草進行研究，請進入危險區域進行採伐。",154,3,3,4,54,20,10,1,2042,2300,False,18,188,0,2002,80014,131176,True,1,357,0,4477,475,29,2,5581915,110093,True,5912194,67
1165,"大規模強行採集：龍族食用的野草","知己知彼，百戰百勝。為了調查龍族的生態，我們想請人採集翻雲霧海生長的野草。最好是龍族或龍族眷屬會吃的野草。",151,3,3,4,54,20,10,1,2042,2300,False,18,188,0,2002,80014,131177,True,1,243,0,4477,475,25,2,5581915,110093,True,5912195,67
1166,"大量採集：用途不明的巨大球薊","最近有某高位祭司秘密委託我們籌備一大批浮島上生長的巨大球薊。說句多餘的，本草學者馬蒂諾先生表示這種植物熬成的茶可以抑制放屁次數和臭味。",152,3,3,4,56,20,1,1,2116,2300,False,18,188,0,2100,80014,131178,True,1,75,0,1608,471,15,5,5581915,110094,True,5912201,67
1167,"指定採集：為戰旗染色的藍花","在雲海發現的一種藍雲花可以製成優秀的藍色染料。我們想用這種染料為神殿騎士團的戰旗染色，請採集藍雲花。",151,3,3,4,56,20,1,1,2116,2300,False,18,188,0,2100,80014,131179,True,1,75,0,1413,471,29,5,5581915,110094,True,5912202,67
1168,"強行採集：調查精油用花蜜","伊修加德正教的各種儀式都需要用到精油。但由於庫爾札斯的氣候變冷，製作精油用的花蜜越來越少了。請去浮島上的候選地調查一下，看看那邊能不能採到可以提煉精油的花蜜。",152,3,3,4,56,20,1,1,2116,2300,False,18,188,0,2100,80014,131180,True,1,51,0,1023,471,25,5,5581915,110094,True,5912203,67
1169,"大規模大量採集：用途不明的巨大球薊","最近有某高位祭司秘密委託我們籌備一大批浮島上生長的巨大球薊。說句多餘的，本草學者馬蒂諾先生表示這種植物熬成的茶可以抑制放屁次數和臭味。",152,3,3,4,56,20,10,1,2116,2300,False,18,188,0,2100,80014,131181,True,1,337,0,9603,476,15,2,5581915,110094,True,5912201,67
1170,"大規模指定採集：為戰旗染色的藍花","在雲海發現的一種藍雲花可以製成優秀的藍色染料。我們想用這種染料為神殿騎士團的戰旗染色，請採集藍雲花。",151,3,3,4,56,20,10,1,2116,2300,False,18,188,0,2100,80014,131182,True,1,337,0,7003,476,29,2,5581915,110094,True,5912202,67
1171,"大規模強行採集：調查精油用花蜜","伊修加德正教的各種儀式都需要用到精油。但由於庫爾札斯的氣候變冷，製作精油用的花蜜越來越少了。請去浮島上的候選地調查一下，看看那邊能不能採到可以提煉精油的花蜜。",152,3,3,4,56,20,10,1,2116,2300,False,18,188,0,2100,80014,131183,True,1,230,0,5053,476,25,2,5581915,110094,True,5912203,67
1172,"採集確認：監視所搭建用建材","神殿騎士團現準備派遣少數部隊進入龍堡內陸低地，從西側監視龍族的動向。奈何現在沒有條件運輸搭建監視所需要的建材，請前往當地勘測是否可以就地取材。",151,3,3,4,58,20,1,1,2033,2300,False,18,188,0,2001,80014,131184,True,1,63,0,1306,472,14,5,5581915,110092,True,5912207,67
1173,"大量採集：沙利亞克之指","在與龍族的戰鬥中犧牲是不可避免的。為了盡可能保住更多人的性命，我們正在大量生產止血劑，但奈何材料不夠了。請前往龍堡內陸低地採伐一種名為沙利亞克之指的樹根。",154,3,3,4,58,20,1,1,2033,2300,False,18,188,0,2001,80014,131185,True,1,70,0,1306,472,15,5,5581915,110092,True,5912208,67
1174,"強行採集：對龍煙霧的材料","據說骨頜族使用一種龍族厭惡的煙霧建立了防衛網，神殿騎士團目前正在研究是否也能製出此種煙霧。請前往候選地調查是否能採伐到作為材料的植物。",151,3,3,4,58,20,1,1,2033,2300,False,18,188,0,2001,80014,131186,True,1,48,0,981,472,25,5,5581915,110092,True,5912209,67
1175,"大規模採集確認：監視所搭建用建材","神殿騎士團現準備派遣少數部隊進入龍堡內陸低地，從西側監視龍族的動向。奈何現在沒有條件運輸搭建監視所需要的建材，請前往當地勘測是否可以就地取材。",151,3,3,4,58,20,10,1,2033,2300,False,18,188,0,2001,80014,131187,True,1,284,0,6116,477,14,2,5581915,110092,True,5912207,67
1176,"大規模大量採集：沙利亞克之指","在與龍族的戰鬥中犧牲是不可避免的。為了盡可能保住更多人的性命，我們正在大量生產止血劑，但奈何材料不夠了。請前往龍堡內陸低地採伐一種名為沙利亞克之指的樹根。",154,3,3,4,58,20,10,1,2033,2300,False,18,188,0,2001,80014,131188,True,1,312,0,6116,477,15,2,5581915,110092,True,5912208,67
1177,"大規模強行採集：對龍煙霧的材料","據說骨頜族使用一種龍族厭惡的煙霧建立了防衛網，神殿騎士團目前正在研究是否也能製出此種煙霧。請前往候選地調查是否能採伐到作為材料的植物。",151,3,3,4,58,20,10,1,2033,2300,False,18,188,0,2001,80014,131189,True,1,213,0,4491,477,25,2,5581915,110092,True,5912209,67
1178,"採集確認：調查採石場候選地","澤梅爾家正在對隼巢進行要塞化工程建設，但建造防護牆用的石材不足導致計劃延期了。為了開拓新的採石場，請前往候選地採集建材樣本。",151,3,2,4,50,20,1,1,2204,2300,False,17,187,0,2200,80014,131190,True,1,81,0,834,478,14,5,5581915,110095,True,5912178,67
1179,"指定採集：修復監視塔用石材","100年前教皇下令修建的12座監視塔大部分都已遭破壞，現今只剩下第九錫杖一座了。為了保護朝聖者，我們想要修復其他的監視塔。請採集需要用到的石材。",152,3,2,4,50,20,1,1,2204,2300,False,17,187,0,2200,80014,131191,True,1,90,0,834,478,29,5,5581915,110095,True,5912179,67
1180,"強行採集：摸索廢材再利用的可行性","過去曾用來照明街道的篝火台現在已經完全被閒置了。目前有人提案可不可以將它拆掉，為隼巢的要塞化工程派上用場。請去破壞掉一小部分，確認它作為石材的質量如何。",151,3,2,4,50,20,1,1,2204,2300,False,17,187,0,2200,80014,131192,True,1,61,0,639,478,25,5,5581915,110095,True,5912180,67
1181,"大規模採集確認：調查採石場候選地","澤梅爾家正在對隼巢進行要塞化工程建設，但建造防護牆用的石材不足導致計劃延期了。為了開拓新的採石場，請前往候選地採集建材樣本。",151,3,2,4,50,20,10,1,2204,2300,False,17,187,0,2200,80014,131193,True,1,365,0,4994,483,14,2,5581915,110095,True,5912178,67
1182,"大規模指定採集：修復監視塔用石材","100年前教皇下令修建的12座監視塔大部分都已遭破壞，現今只剩下第九錫杖一座了。為了保護朝聖者，我們想要修復其他的監視塔。請採集需要用到的石材。",152,3,2,4,50,20,10,1,2204,2300,False,17,187,0,2200,80014,131194,True,1,401,0,4344,483,29,2,5581915,110095,True,5912179,67
1183,"大規模強行採集：摸索廢材再利用的可行性","過去曾用來照明街道的篝火台現在已經完全被閒置了。目前有人提案可不可以將它拆掉，為隼巢的要塞化工程派上用場。請去破壞掉一小部分，確認它作為石材的質量如何。",151,3,2,4,50,20,10,1,2204,2300,False,17,187,0,2200,80014,131195,True,1,274,0,3369,483,25,2,5581915,110095,True,5912180,67
1184,"採集確認：異端者建築的石材","某個貴族為神殿騎士團提供了很多資金。作為條件，這位虔誠的貴族提出要破壞異端者的建造物。為了滿足這位重要贊助人，請前往陸行鳥之森破壞遺跡的一角帶回來。",153,3,2,4,52,20,1,1,2018,2300,False,17,187,0,2000,80014,131196,True,1,77,0,932,479,14,5,5581915,110096,True,5912189,67
1185,"大量採集：對龍散彈炮用礦石","天鋼機工房開發了新型的對龍加農炮炮彈。想增產這種發射時可以散裂開進行廣域打擊的特殊炮彈，必須使用某種特定硬度的礦石才行。請前往龍堡參天高地採集特殊礦石數槍礦。",151,3,2,4,52,20,1,1,2018,2300,False,17,187,0,2000,80014,131197,True,1,85,0,1062,479,15,5,5581915,110096,True,5912190,67
1186,"指定採集：正教的祭具用原石","教皇廳分派了前往危險區域進行採集的任務，據說是需要一種優質的星藍石來製作新祭具。請求能夠前往陸行鳥之森進行採集的熟練採礦工協助。",152,3,2,4,52,20,1,1,2018,2300,False,17,187,0,2000,80014,131198,True,1,85,0,997,479,29,5,5581915,110096,True,5912191,67
1187,"大規模採集確認：異端者建築的石材","某個貴族為神殿騎士團提供了很多資金。作為條件，這位虔誠的貴族提出要破壞異端者的建造物。為了滿足這位重要贊助人，請前往陸行鳥之森破壞遺跡的一角帶回來。",153,3,2,4,52,20,10,1,2018,2300,False,17,187,0,2000,80014,131199,True,1,347,0,4767,484,14,2,5581915,110096,True,5912189,67
1188,"大規模大量採集：對龍散彈炮用礦石","天鋼機工房開發了新型的對龍加農炮炮彈。想增產這種發射時可以散裂開進行廣域打擊的特殊炮彈，必須使用某種特定硬度的礦石才行。請前往龍堡參天高地採集特殊礦石數槍礦。",151,3,2,4,52,20,10,1,2018,2300,False,17,187,0,2000,80014,131200,True,1,382,0,5742,484,15,2,5581915,110096,True,5912190,67
1189,"大規模指定採集：正教的祭具用原石","教皇廳分派了前往危險區域進行採集的任務，據說是需要一種優質的星藍石來製作新祭具。請求能夠前往陸行鳥之森進行採集的熟練採礦工協助。",152,3,2,4,52,20,10,1,2018,2300,False,17,187,0,2000,80014,131201,True,1,382,0,4117,484,29,2,5581915,110096,True,5912191,67
1190,"採集確認：翻雲霧海的地質調查","神殿騎士團正在討論是否能在翻雲霧海修建一個據點。請前往沒有被龍族支配的土地勘探地質，務必不要勉強自己做危險的事情。",151,3,2,4,54,20,1,1,2042,2300,False,17,187,0,2002,80014,131202,True,1,72,0,902,480,14,5,5581915,110098,True,5912196,67
1191,"指定採集：夢幻蒼天沙","千年前建國時期生產的武器都用了某種有著誇張硬度的金屬，據說那是因為在精煉時摻入了雲海某種特殊的沙子。請依照記錄採集那夢幻般的蒼天沙。",153,3,2,4,54,20,1,1,2042,2300,False,17,187,0,2002,80014,131203,True,1,80,0,902,480,29,5,5581915,110098,True,5912199,67
1192,"強行採集：解開歷史謎團的史料","聽聞通往翻雲霧海的航路被拓展開了，神殿騎士團總部決定進行歷史調查。請前往龍族遍地走的危險地帶收集能解開歷史謎團的遺物。",152,3,2,4,54,20,1,1,2042,2300,False,17,187,0,2002,80014,131204,True,1,54,0,902,480,25,5,5581915,110098,True,5912200,67
1193,"大規模採集確認：翻雲霧海的地質調查","神殿騎士團正在討論是否能在翻雲霧海修建一個據點。請前往沒有被龍族支配的土地勘探地質，務必不要勉強自己做危險的事情。",151,3,2,4,54,20,10,1,2042,2300,False,17,187,0,2002,80014,131205,True,1,324,0,3502,485,14,2,5581915,110098,True,5912196,67
1194,"大規模指定採集：夢幻蒼天沙","千年前建國時期生產的武器都用了某種有著誇張硬度的金屬，據說那是因為在精煉時摻入了雲海某種特殊的沙子。請依照記錄採集那夢幻般的蒼天沙。",153,3,2,4,54,20,10,1,2042,2300,False,17,187,0,2002,80014,131206,True,1,357,0,3502,485,29,2,5581915,110098,True,5912199,67
1195,"大規模強行採集：解開歷史謎團的史料","聽聞通往翻雲霧海的航路被拓展開了，神殿騎士團總部決定進行歷史調查。請前往龍族遍地走的危險地帶收集能解開歷史謎團的遺物。",152,3,2,4,54,20,10,1,2042,2300,False,17,187,0,2002,80014,131207,True,1,243,0,3502,485,25,2,5581915,110098,True,5912200,67
1196,"大量採集：雲海的亞戰神礦","據艾因哈特家薔薇騎兵團的報告，在阿巴拉提亞雲海的浮島可以採集到一種類似戰神礦的礦石。為了研究出利用它的新金屬鍛造法，請前去採集大量樣本。",151,3,2,4,56,20,1,1,2116,2300,False,17,187,0,2100,80014,131208,True,1,75,0,828,481,15,5,5581915,110099,True,5912204,67
1197,"指定採集：風屬性雲海沙","據說浮島的某些地區可以採集到蘊含大量風屬性力量的礦石。天鋼機工房決定對它加以研究，看看能不能為新造飛空艇提供浮力。請前去採集作為樣本的雲海沙。",151,3,2,4,56,20,1,1,2116,2300,False,17,187,0,2100,80014,131209,True,1,75,0,828,481,29,5,5581915,110099,True,5912205,67
1198,"強行採集：混凝土用輕石","伊修加德的各種石質建築都需要補強用的混凝土。據說其製作材料輕石可以在阿巴拉提亞雲海的浮島上採集到。為了確認雲海的輕石品質是否過關，請前去採集樣本。",151,3,2,4,56,20,1,1,2116,2300,False,17,187,0,2100,80014,131210,True,1,51,0,828,481,25,5,5581915,110099,True,5912206,67
1199,"大規模大量採集：雲海的亞戰神礦","據艾因哈特家薔薇騎兵團的報告，在阿巴拉提亞雲海的浮島可以採集到一種類似戰神礦的礦石。為了研究出利用它的新金屬鍛造法，請前去採集大量樣本。",151,3,2,4,56,20,10,1,2116,2300,False,17,187,0,2100,80014,131211,True,1,337,0,3428,486,15,2,5581915,110099,True,5912204,67
1200,"大規模指定採集：風屬性雲海沙","據說浮島的某些地區可以採集到蘊含大量風屬性力量的礦石。天鋼機工房決定對它加以研究，看看能不能為新造飛空艇提供浮力。請前去採集作為樣本的雲海沙。",151,3,2,4,56,20,10,1,2116,2300,False,17,187,0,2100,80014,131212,True,1,337,0,3428,486,29,2,5581915,110099,True,5912205,67
1201,"大規模強行採集：混凝土用輕石","伊修加德的各種石質建築都需要補強用的混凝土。據說其製作材料輕石可以在阿巴拉提亞雲海的浮島上採集到。為了確認雲海的輕石品質是否過關，請前去採集樣本。",151,3,2,4,56,20,10,1,2116,2300,False,17,187,0,2100,80014,131213,True,1,230,0,3428,486,25,2,5581915,110099,True,5912206,67
1202,"採集確認：貫穿龍族的小刀礦","過去我們通過與殖民城市薩雷安進行貿易獲得的礦物在大撤退後變得很難入手了。這種小刀礦是製作對龍弩炮弩箭的重要礦石，請前往小刀石柱群嘗試採掘它。",151,3,2,4,58,20,1,1,2033,2300,False,17,187,0,2001,80014,131214,True,1,63,0,916,482,14,5,5581915,110097,True,5912211,67
1203,"大量採集：彩色水晶的部件","教皇廳現決定大規模修繕其內部的彩色水晶。為此他們派發了籌集擁有一定透明度的水晶的委託。此為前往危險地帶進行的採集任務，請求熟練的採礦工協助。",152,3,2,4,58,20,1,1,2033,2300,False,17,187,0,2001,80014,131215,True,1,70,0,916,482,15,5,5581915,110097,True,5912212,67
